.gxl	Graph Exchange Language file
.ywl	YoWindow data file
.depend	Code::Blocks project support file
.robo	RoboRealm robo script file
.appxmanifest	Windows Store app source manifest file
.hic	HicEst script file
.iss	Inno Setup script file
.mly	OCaml ocamlyacc input file
.bbc	BBC BASIC for Windows data file
.jcl	IBM Job Control Language file format
.has	Haskell script file
.qdl	QDL source code file
.pb	PureBasic source code
.jak	AHEAD Tool Suite file
.hxx	C++ header file
.scm	Scheme language source code file
.psu	PS2 YABASIC file
.vsmacros	Microsoft Visual Studio binary-based macro project
.li$	Microsoft Linker compressed input library file
.ph	Perl header file
.aem	Alphacam wire EDM parameter macro file
.gml	Graph Modeling Language file
.pf2	SmartWare project source code file
.bet	BETA source file
.dsp	Microsoft Developer Studio project file
.gc3	Golden Common Lisp source code file
.dsym	ArchiCAD for MAC Geometric Description Language file
.zpl	ZEMAX programming language file
.okm	Open Knowledge Management script file
.rpym	Ren'Py module file
.chh	C++ header file
.tik	Game texture script file
.pro	IDL programming language source code file
.dlg	C++ dialogue script file
.lbi	Adobe Dreamweaver library file
.tag	COREX file
.git	Git repository file
.b	BASIC language source file
.jsb	JAWS script binary file
.gus	Universal Score Poster script file
.rb	Ruby on Rails class file
.bsm	Project file
.d4	Dataphor source file
.cuh	CUDA header file
.wax	ProComm Plus compiled script file
.sjc	Sothink JavaScript Web Scroller definition file
.pp	Free Pascal source code file
.scar	SCAR script file
.rkt	Racket information module file
.a3x	AutoIt compiled script file
.ftn	Fortran language source code file
.ked	KEDIT profile and macro File
.res	Microsoft C, C++ compiled resource file
.stl	C++ standard template library
.maml	Microsoft Assistance Markup Language
.tlh	Typelib generated C/C++ header file
.ebs2	E-Prime E-Run script file
.xmla	XML for Analysis source file
.cshrc	UNIX command file
.oqy	Microsoft Excel OLAP query file
.tem	Borland C++ Turbo Editor Macro Language script file
.brx	BREW MP application resource file
.clp	CA-Clipper compiler script file
.mx	Modula-3 linker information
.mcml	Microsoft Windows Media Center MCML file
.pas	SIMATIC WinCC script file
.xoml	Microsoft Visual Studio XOML file
.mmjs	Adobe JavaScript document file
.rmn	Oracle Recovery Manager script file
.ghc	Visual Basic constant map file
.deb	Debug script of DOS MS Debug
.mln	Alchemy source file
.dht	DanTemplate HTML Template file
.playground	Apple Xcode playground file
.ba_	Renamed BAT file
.sid	OpenOffice.org slot id file
.bdsproj	Borland Developer Studio project file
.dpr	Pascal file
.kv	Kivy language file
.a	Assembly source code file
.configure	Bash file
.kex	KEDIT profile macro file
.lng	Lahey Fortran language file
.pem	Corel WordPerfect program editor macro file
.pfx	PFXplus application source code
.scz	Wingz script file
.lpr	Lazarus project file
.psml	Packet Summary Markup Language file
.pf?	SmartWare project source file
.php1	PHP1 auto file
.hh	C++ header file
.zfd	ABC Zeroadic functions file
.bhs	Rise of Nations script file
.vdp	Microsoft Visual Studio deployment project file
.applescript	AppleScript script file
.sbh	IBM SQABasic header file
.aro	SteelArrow script file
.lrs	Lazarus Resource file
.greenfoot	Greenfoot project file
.jbi	Motoman robot job file
.cfo	Turbo C utilities C form object file
.kbs	Keyboard Script saved keystrokes file
.avsi	Avisynth script file
.fcgi	FastCGI script file
.smd	Scheme file
.cod	Microsoft C compiler output
.phpt	PHP test suite file
.login	UNIX command file
.qs	Qt script file
.mmh	Dragon Age Model Mesh Heirarchy file
.dxl	Domino XML file
.epl	Encirq \PL programming language source file
.mako	Mako tamplate file
.ahtml	HTML file
.vbscript	Visual Basic script
.cola	Cola source code file
.cfml	Adobe ColdFusion Markup language file
.exw	Euphoria Windows source code file
.f77	Fortran 77 language source file
.mnd	AutoCAD Menu Compiler file
.irobo	RoboMind source code file
.gs	Haskell Gofer script file
.tst	TagScanner text transform script file
.ldz	Microsoft Visual Studio DSM project file
.fxml	Oracle FXML language source code
.go	Google Go programming language source code file
.cl	Common Lisp programming language source code file
.fasl	Scheme file
.xcodeproj	XCode project file
.reb	REBOL script file
.mod	PHP source code
.rsp	Rapport script file
.mp?	LoseThos Compiler map file
.vmx	Microsoft Visual Studio Visual C++ macro project file
.javajet	Eclipse JET Java template file
.v3s	Visual3D pipeline file
.abc	ABC programming language file
.asp	Procomm Plus ASPect language script file
.xsql	Oracle XSQL Servlet server side file
.sdi	Interface definition file
.xtxt	Xtext file
.gradle	Android Studio buid file
.tab	Microsoft SQL table script file
.xnf	Extensible Numerical file
.rbp	REALbasic project file
.mat	Poser 3D pose file
.spx	Microsoft FoxPro compiled form source file
.glade	Glade project
.apt	Almost Plain text file
.spt	Cypress Semiconductor USB console script file
.rbx	Ruby programming language source code file
.usi	UsiXML UI description file
.mqt	MetaQuotes Language 4 MQL4 template file
.ap?	LoseThos C+ source file
.scb	Scala InfoChannel published script
.d	D Programming Language source code file
.hla	High Level Assembler source file
.vpi	Virtual Pascal OS/2 unit file
.mss	Manuscript text file
.mst	Visual Test source file
.simple	Simple Compiler source code file
.map	Server side image map file
.rfx	Modula M2SDS file
.wis	IBM wIntegrate basic script file
.smx	SMX file
.kcl	Kyoto Common LISP source code
.slogt	StarLogo template file
.creole	Creole source file
.hrl	Erlang source or script file
.sc	Corel Paradox PAL script file
.hxml	haXe make file
.mod	Fortran module file
.js	ECMAScript language file
.goc	GEOS GOC source code file
.m4	M4 preprocessor macro file
.rexx	Rexx language source code file
.sc	Ingres Embedded SQL/C source file
.wdproj	Microsoft Visual Studio web deployment project file
.pwo	Portable Website Object file
.lrf	Microsoft C/C++ linker response file
.ls1	Microsoft Winhelp source file
.policy	Opera policy file
.sp?	LoseThos C+ source file
.hp?	LoseThos C+ header file
.wdw	WINDEV window file
.pf1	SmartWare project source code file
.haml	HTML abstraction markup language file
.fountain	Fountain syntax file
.dpk	Pascal file
.ow	Free Pascal for Windows object file
.dsq	Corel Query Language file
.wpj	Watcom C/C++ project file
.cnt	602Pro PC Suite macro file
.pgml	Precision Graphics Markup Language file format
.mbas	mikroBasic source code file
.asf	APL*PLUS/PC shared file
.lsp	AutoLISP language source code
.svc	Simple Visual Compiler file
.cls	Microsoft Visual C++ class definition
.php4	HTML page with PHP (HyperText PreProcessor)
.xys	XYplorer script file
.erl	Erlang source or script file
.autoplay	AutoPlay Media Studio project file
.buildpath	Eclipse XML build path file
.~df	Delphi form backup file
.wod	Apple WebObjects web application method file
.msc	C makefile
.udf	SQL user defined function script file
.clj	Clojure source code file
.inp	Oracle source code
.ms	3D Studio Max script source code
.rxs	RSIGuard RSIScript file
.entitlements	Apple Mac OS X sandbox file
.nes	Nessus attack scripting language key file
.gml	Game Maker script file
.rbs	Microsoft Windows Installer Rollback Script file
.bur	BuRg3r source code file
.xbap	XAML Browser Application file
.rnw	Sweave source file
.ps2	Microsoft Windows Shell script file
.j3d	Java 3D object file
.as3	APL*PLUS source code file
.dia	Do It Again macro script file
.qac	C++ Dedicated PROGRUN file
.dse	DAZ Studio encrypted script file
.csm	Borland C++ precompiled header file
.rqy	Microsoft Excel OLE DB query file
.confluence	Eclipse Mylyn WikiText confluence file
.sbs	SPSS script file
.m3	Modula 3 programming language source code
.obj	Intel (Object Module Format) relocatable object module
.hbm	Hibernate script file
.glf	Pointwise TCL script file
.flm	Flasm disassembled Flash ActionScript bytecode file
.xamlx	XAMLX document file
.xlv	Microsoft Excel VBA module file
.wdi	WINDEV component description file
.osg	OSGJS JSON input file
.xig	XML Instance Generator file
.kml	HP48 emulator Win48 script
.aut	AutoIt pre v3 script file
.qx	Quexal source code
.mash	Java file
.ml	OCaml source code file
.thor	Thor file
.htd	Adobe ExtendScript HTML file
.atmn	Automation Anywhere macro file
.vjp	Microsoft Visual J++ project file
.tql	Microsoft SQL Server query analyser header file
.scm	PDP-10 source compare file
.cp?	LoseThos C+ source file
.ekm	EXP macro file
.hpp	C++ header file
.viw	Microsoft SQL Server view script file
.mca	Apis Ceratina file
.cpy	Cobol include file
.turboc3	Borland Turbo C makefile
.dcf	D-LIB generic bytecode
.bpk	C++ Builder package file
.h2o	Water web program file
.mtp	EasyBuilder 8000 project file
.tikz	Matlab tikz script file
.mingw32	Mingw compiler file
.xl	XBLite source code file
.xmap	CodeWarrior linker file
.msl	ImageMagick scripting language file
.odh	Microsoft Visual Studio Interface Definition Language file
.tml	WZ Editor document or macro file format
.rake	Ruby makefile
.itcl	Cygwin iwidgets scripts file
.pcd	Microsoft Visual Test file
.pkh	Oracle PL/SQL package file
.w	OpenEdge Architect source code file
.msvc	Microsoft Visual C++ compiler makefile
.vc2	Microsoft Visual C file
.dic	Microsoft Dynamics GP program source code
.dwarf	Deebug with arbitrary record format file
.sts	Microsoft C project status info
.hcw	HTML Help Workshop Conversion Wizard Macro file
.ix3	Instant.Exe 3.0 script file
.prg	RPG Toolkit program script
.v	Verilog source code file
.poix	Point of interest exchange file
.pp	Perl Data Language PreProcessor file
.sno	Snobol4 language source code file
.tcsh	Unix shell script file
.xbl	XBLite source code file
.con	Concept Application Server source code file
.clw	Clarion source code file
.ts0	tio32 script file
.gemfile	Ruby RubyGems file
.borland	Borland C makefile
.mb	MapBasic program file
.11	IBM Voice Type languages scripts data file
.sdef	AppleScript dictionary scripting definition
.pom	Maven build file
.wam	WebAction macro file
.aml	Mio technology application markup language
.awl	Alternative Web Language programming language file
.woa	WebObjects script file
.graphmlz	Compressed GraphML source file
.c__	C++ source code file
.jcm	Java Commerce Message file
.lex	HP-Basic language extension
.rbx	IBM Rembo-C compiled script file
.pgm	Signature program
.wsd	RoboSoft script file
.xhtm	Extensible HTML file
.image	Squeak code file
.c	AutoCAD Development System (ADS) source code file
.chd	Chart FX file
.cr	CRiSP source code file
.ssc	MediaShout presentation script
.dbproj	Microsoft Visual Studio Visual C++ database project file
.avc	Avid Media Composer script file
.zts	ZTerm script file
.vgc	ViziGen source code file
.dts	Directory toolkit script file
.i	Microsoft Visual Studio preprocessed source file
.ixx	Modula-3 Linker information file
.msm	ArchiCAD Geometric Description Language file
.b2d	Brutus2D source code file
.bml	Better Markup Language
.dpj	Borland Delphi project file
.ogx	Microsoft C++ Component Gallery exported classes and resources
.ago	Autolog script file
.s2s	Spike2 script file
.alx	Alpha Five database information file
.zrx	ZOC REXX script file
.mingw	MinGW make file
.pjt	Visual FoxPro associated memo file
.edml	EDML Parser-Library file
.mm	Groff MM format source file
.bufferedimage	Java class
.rhtml	Ruby HTML web page file
.s	DigitalMicrograph script
.llf	IITM local language file
.zsh	Unix shell script
.aplt	Mac OS X AppleScript applet file
.ex	Euphoria source code
.lp	LP88 linear programming for the IBM-PC file
.ebs	EyeBatch command script file
.jpd	Java process definition file
.sconstruct	SCons makefile
.arnoldc	ArnoldC source code file
.~pa	Delphi Pascal backup file
.yxx	Bison source code file
.asc	Apohysis script file
.dws	Netop script file
.btq	Teradata Database query script file
.py	Oracle batch procedure file
.sym	Borland C++ precompiled header file
.mss	MediaShout presentation script
.mdp	Microsoft Visual Studio Visual Basic workspace file
.sltng	StarLogo TNG project file
.ptl	Microsoft Visual Modeler petal file
.dro	D-Robots robot file
.alg	PDP-10 ALGOL compiler source
.tsc	ZEMAX tolerance script file
.l	Xcode core Lex program file
.sas	StreamAction Script file
.bsml	Bioinformatic data file
.orc	Oracle 7 script file
.f40	PDP-10 FORTRAN-4 compiler source file
.ttcn	TTCN-3 script file
.awk	AWK programming language script file
.hbx	StarMoney macro file
.mc	MetaCard stack file
.a66	µVision Assembler source file
.lamp	ArchiCAD for MAC Geometric Description Language file
.inc	Pascal file
.mpx	BX-24 Basic Express compiler map
.c	ANSI C script file
.gobj	Geoworks object code file
.sf	SF programming language source code file
.idb	Delphi Pascal object file
.mi	Winamp MAKI scripting library
.robo	RoboMind source code file
.dg	Source code for a dialog box
.mvc	Miva compiled script file
.ju	JU source code
.scp	Microsoft dial-up networking script
.wbc	WinBatch encoded script
.mdex	Mifos Data Exchange XML file
.ap	Fifth Generation Systems active page file
.gsb	Gain script binary file
.epj	RapidSQL SCCS project
.mlsxml	Skype XML file
.cls	Microsoft Visual Basic 4 class module add-in
.ll	Lex source code file
.api_filters	Eclipse API settings file
.yab	Yabasic source code
.4th	Forth source code file
.sxt	Formula Graphics script file
.cxt	CX-Programmer PLC program file
.wmlc	Wireless Markup Language bytecode document (WAP)
.smi	Synchronized Multimedia Integration Language presentation file
.cgvp	nVidia Cg programming language XML file
.pfa	Formdef or Pagedef source code file
.plx	PiXCL Pixel Based Extendible Command Language script file
.was	ProComm source script
.wml	Website META language file
.jsfl	Flash JavaScript file
.actionscript	Adobe Flash ActionScript
.apg	APGen script file
.mex	Macro Express macro file
.e	EiffelStudio source file
.lo	Interleaf compiled Lisp file
.dsa	DAZ Studio script file
.asr	Adobe Flash ActionScript remote file
.ebs	IBM Rational Rose script source file
.ii	Preprocessed C++ source code file
.kb	Borland C++ Keyboard Script file
.vc5	Microsoft Visual C make file
.pf4	SmartWare project source code file
.avs	Avisynth script file
.akp	QuickZip file
.nmk	Microsoft Program Maintenance Utility make file
.ccbjs	CopperCube JavaScript scene file
.wmls	Wireless Markup Language script file (WAP)
.pxl	PiXCL Imaging language source file
.pc	Oracle Pro*C source code file
.fp	CDE Front Panel file
.sbml	Systems Biology Markup Language source file
.rprofile	Quick-R R programming language configuration file
.pmod	Pike module file
.pike	Pike source code file
.fzs	FilZip backup script file
.btproj	Microsoft BizTalk Server project file
.dbo	DarkBASIC source code file
.csh	CARA script interpreter engine script
.dml	Medical Manager DML system script file
.jcw	JCreator workspace file
.rng	RELAX NG source code file
.vsprops	Microsoft Visual Studio project property sheet file
.bmml	Braille Music Markup Language file
.rsl	Robot Scripting Language file
.h--	Sphinx C-- header file
.ods	NCompass Labs internet related script file
.b24	Ovation Pro for RISC OS C script file
.vc	Verge code file
.sbi	SetupBuilder include script file
.grxml	Grammar file
.geojson	GeoJSON geographic format
.a86	A86 Assembly language source code file
.mls	mAirList script file
.jsxinc	Adobe JavaScript file
.pvs	PolyView slide show script
.y	Xcode core yacc program
.ht4	HTML file Version 4 file
.pd	Perl Data Language preprocessor file
.pxt	PEST - the professional exam system quiz script
.sc	SuperCollider source code file
.ccxml	Call Control eXtensible Markup Language file
.spk	Not compiled software package file
.pika	Pika Software Builder project file
.hxa	Microsoft Help attribute definition file
.triple-s	Triple-S Surveying file format file
.wzs	Microsoft Word wizard file
.bxb	BasicX compiled project bytecode
.t	Turing programming language file
.mem	Corel WordPerfect Macro editor file
.cb	CoolBasic src file
.pde	Processing development environment source code file
.psf	PID script file
.cas	Borland combined C/Assembly source code file
.fgl	Fifth Generation Language (5GL) source code file
.dba	DarkBASIC source code
.pls	PerlScript file
.p	Pascal language source code file
.ass	Assembler/Disassembler 68HC11 file
.lit	Literate Haskell script file
.cod	FORTRAN program compiled code file
.hhh	Power C precompiled header file
.icl	Clean source code file
.es	ECMAScript language file
.dmc	Sage Medical Manager script file
.ipp	Inline guard macro file
.oplm	Outline Processor Markup Language file
.tal	Transaction Application Language source code
.neko	Neko source code file
.aex	Alpha Five linked executable file
.ch	Clipper include file
.cla	Clarion for DOS source code file
.kpl	Kids Programming Language source code file
.osax	FindFile OSAX mac file type
.mcr	Autodesk 3D Studio Max macroscript file
.cu	CUDA source code file
.acgi	ACGI Script (WWW)
.is	Modula-3 intermediate assembly file
.a2x	a2x file
.csf	VanDyke SecureCRT script file
.egg	Explosion Graphics Generator script file
.sjs	Sugar script file
.docstates	Microsoft Visual Studio Document Tab Well file
.mscr	ServiceMon script file
.xlm_	Microsoft Excel 2 for Mac Macro file
.pxd	Pyrex definition file
.dd	Microsoft Visual Studio deployment diagram file
.v	V++ VPascal source code
.par	Script particles file
.scptd	AppleScript script bundle file
.syp	SYP source file
.cal	Cakewalk application language script file
.h__	C++ header file
.pl1	PL/1 programming language source file
.tiprogram	TI-Basic source code file
.pf0	SmartWare project source code file
.cc	ADS source code file
.axe	Paradigm C++ integrated debugger file
.unx	UNIX specific makefile
.xbc	OEPE JAXB Wizard bindings file
.dcf	Directory Opus command file
.jsh	JAWS Script Header file
.mdf	Cisco IOS Embedded Menu Manager menu definition file format
.text	ArchiCAD for MAC Geometric Description Language file
.vc7	Microsoft Visual C makefile
.pdl	Programmable Driver Language file
.eek	Arachne script file
.csp	Intersystems Caché server page file
.skp	COREX orthographic transcription with signal linking file
.ps2xml	Windows PowerShell file
.kl3	KL3 source code file
.js	JACOsub script file
.daemonscript	Daemon Tools script file
.ssc	Stellarium script file
.radius	Ruby-Radius scipt file
.defi	Oracle 7 de-install script file
.kumac	Physics Analysis Workstation macro file
.mix	Power C object file
.tmo	Zortech C++ global optimizer default output file
.il	Euphoria shrouded source code
.netboot	Unix netboot script file
.asproj	Microsoft Visual Studio Analysis Services project file
.mjk	NLMTIM question file
.wcm	Corel WordPerfect macro file
.89x	Texas Instruments TI-89 macro file
.bps	BatchPhoto script file
.cel	Celestia 3D rendering script
.xsc	XVI32 script file
.opx	Psion Organiser programming language
.d	Dialect source code file
.db	Atari Jaguar debugger script file
.fpc	FreePascal Compiler makefile
.ssml	Speech Synthesis Markup Language source file
.psc2	Microsoft Windows PowerShell script file
.m	Script file (Miranda IM language)
.tokend	Smart Card support mac file type
.hsc	HelpScribble project source file
.clu	CLUCalc CLUScript file
.pwn	Pawn source code file
.cya	Cyana macro file
.ism	ArchiCAD Geometric Description Language file
.x	XBLite program file
.dbheader	Download Boost header file
.genmodel	Eclipse IDE domain gen model file
.hal	HansaWorld Enterprise HAL code file
.asic	ASIC source file
.tilemap	XML tilemap format
.dml	DynaScript markup language file
.src	DataFlex/Multi-Edit source file
.frs	Flash Renamer script file
.wsym	ArchiCAD for MAC Geometric Description Language file
.mtx	M-Tx Music-From-Text translator source file
.vc4	Microsoft Visual C++ makefile
.a3c	Alan v3 adventure code file
.vic	ViziGen source code file
.scriptsuite	AppleScript script suite file
.ocr	Subtitle Workshop script file
.bml	Bean Scripting Framework (BSF) file
.db2	Microsoft Visual Studio DB2 SQL script file
.e	Amiga E source code file
.vad	Vadera Enterprises PHP file
.hydra	Adobe Pixel Bender kernel file
.csc	Ovation Pro C script file
.mml	Mobile Markup Language file
.mcr	CuteFTP script file
.csi	Corel script file
.forth	Forth source code file
.xojo_project	Xojo programming project file
.mfps	Scientific Calculator Plus script file
.ds	DAZ Studio script file
.lbj	LBJava source code file
.oppo	oppo core file
.wch	WellCAD header file
.ags	AfterGRASP script file
.m4x	SynDEx file
.cfs	ChatFactory script file
.art	Artifacts artifact file
.cs	Torque game engine script file
.dpr	Borland C++ default project file
.armx	ASP.NET source file
.atp	Automise project file
.mscr	Rename Master scrip file
.aso	Turbo Assembler object file
.ice	IceChat IRC client script file
.wbs	WinBot IRC bot script file
.abs	TurboZIP script file
.an	Adobe Edge Animate project file
.xpdl	XML Process Definition Language file
.pp1	Free Pascal compiled unit file
.rex	Rexx language source code
.fsproj	Microsoft Visual Studio Visual F# project file
.md	Machine description file
.slackbuild	Slackware Linux script file
.rsm	ArchiCAD Geometric Description Language file
.exu	Euphoria for Linux source code file
.f	Win32Forth source code
.fdml	Forms Definition Markup Language file
.slt	Telix Salt Script Application Language script source
.abl	ABEL hardware description language
.cod	dBASE template source file
.il	MSIL Assembler input file
.vdm	VDM specification file
.car	Brew MP component application resource file
.csml	Chemical Style Markup Language file
.msdl	Manchester Scene Description Language file
.sfl	SF programming language source code library file
.h6h	HLC script file
.tld	Tag Library Descriptor file
.vspolicy	Microsoft Visual Studio Policy Description Language file
.judo	JudoScript Source Code file
.mml	Gordano Mail Meta Language file
.icn	Icon language source code file
.plc	Lotus add-in functions macros applications
.trs	TURBU Editor RPG script file
.a8s	Anim8or script file
.dtml	Zope Document Template Markup Language file
.rproj	RStudio project
.asm	Alphacam stone parameter macro file
.lasso	Lasso database driven web page
.alm	Alphacam laser parameter macro file
.dt	PowerBASIC file
.ad2	ad2 web page script file
.scp	SCAR Divi macro script file
.txc	txtCompiler script file
.bli	PDP-10 BLISS-10 compiler source file
.zfs	C++ assembly source file
.d2j	d2jsp script file
.sqldataprovider	DotNetNuke script file
.ebuild	Portage eBuild script file
.3rf	Advent 3B2 extensions script cross reference file
.ac	GLPK automake/autoconf configure definitions file
.irbrc	Ruby file
.mm	NeXtMidas macro file
.xmljet	Eclipse JET XML template file
.owd	OpenWire project file
.bms	Bitmove Multimedia Script file
.v4s	Microsoft Windows Script Host file
.fsproj	FireStarter Project File
.cap	Code Architect project file
.box	MediaShout presentation script
.cp	Adobe Audition script file
.eqn	KaleidaGraph macro file
.jomproj	Microsoft Visual Studio JOOB object model project file
.vala	Vala programming language source code
.aml	ACPI machine language file
.hrh	Common header for resources and C++
.gadgeprj	Gadge It project file
.rb	REALbasic project file
.pds	PALASM source code file
.boo	Boo class file
.app	CA Visual Objects platform for developer (CAVO) project file
.msh1xml	Windows Power Shell script file
.4pk	Perfect Keyboard macro set
.cvsrc	TortoiseCVS CVS command file
.rpprj	Axure RP project file
.lols	LOLCODE source code file
.h++	Unusual C++ header file
.ic	Modula-3 M3CG intermediate language file
.scx	Microsoft Class Browser form
.psl	PATROL script language script file
.wix	wIntegrate compiled script file
.msp	Max Script Page
.imp	Pascal implementation file
.mod	Modula-2 programming language source code
.dwt	Adobe GoLive template file
.tpt	PCLTool transformation parameter table file
.nokogiri	Nokogiri source file
.uih	Geoworks UI Compiler espire header file
.xojo_binary_project	Xojo binary project file
.exv	Adobe Extension Manager file
.ipy	IPython script
.lpr	LAPRO source code file
.tpx	Turbo Pascal unit file
.builder	Builder script
.sfp	SF programming language processed source code file
.ssc	Xaira script file
.19	IBM Voice Type languages scripts data file
.ipproj	Microsoft Visual Studio InfoPath project file
.gs	Gosu class file
.djg	DJGPP Compiler makefile
.hei	Heitml source code
.shfbproj	Sandcastle Help File Builder project file
.pxl	PixCLscript script
.wmc	Corel WordPerfect macro file
.nqc	NQC Not Quite C source code file
.cbq	StarOS script file
.pgm	Chromeleon batch program file
.gst	GAIN script text
.tps	Crazy Talk expression script file
.generictest	Microsoft Visual Studio generic test file
.fmt	ENVI tape script file
.rapc	Java 2 ME unit file
.bi	Microsoft Visual Basic for DOS include file
.jsm	JAWS script message file
.asbx	Microsoft ASP.Net BridgeHandler file
.qlc	Adobe Type Manager ATM Type 1 fonts script file
.texinfo	Texinfo source file
.wixout	WiX XML output file
.ff	ARRIS SigmaC source file
.lds	Laser Dispatch script file
.act	DS Game Maker action file
.c	Atari Lite-C script file
.di	D Programming Language source code
.ook	Arachne batch script file
.osas	Apple Script library tani script file
.2clk	Frontier Script File
.dfm	Pascal file
.spr	IBM Telelogic Tau SDL Suite design file
.lay	Track Builder simulation compiler code
.bpt	COREX segmentation file
.script editor	Apple Mac OS X AppleScript script file
.ash	KoLmafia ASH script file
.pdl	Borland C++ project description language file
.sit	PDP-10 Fortran-77 compiler source file
.src	Source resource string file
.pri	COREX orthographic transcription file
.wx	wxBasic programming language file format
.cap	Construct game development file
.dgsl	Microsoft Visual Studio visual shader graph file
.wsil	IBM Web Services Inspection Language file
.hay	Haydee web server module file
.xlm4	Microsoft Excel 4 for Mac Macro file
.dms	BYOND script file
.mdp	Microsoft Developer Studio project file
.tql	Tree Query Language file
.qf	FORTRAN embedded QUEL file
.tu	Turing source code file
.ccp	CopperCube JavaScript file
.owl	Web Ontology Language file
.cxl	Content Extraction Language script file
