.xlm4	Microsoft Excel 4 for Mac Macro file
.dms	BYOND script file
.mdp	Microsoft Developer Studio project file
.tql	Tree Query Language file
.qf	FORTRAN embedded QUEL file
.tu	Turing source code file
.ccp	CopperCube JavaScript file
.owl	Web Ontology Language file
.cxl	Content Extraction Language script file
.spt	Spitbol language source code file
.tlc	Compiled Tool Command Language source code
.komodo	KMD file
.adb	Alphacam die-cut VB macro file
.prx	COREX prosodic annotation file
.pdl	Perl Data Language file
.dil	DesignComposer input DIL script file
.vss	VectorWorks VectorScript file
.ucb	Unstoppable Copier batch file
.frj	FreeForm-J project file
.alb	Alphacam laser VB macro file
.pxi	Pyrex header file
.bil	Lisp source file
.seman	Xtext semantics file
.b	Modula-3 base program file
.hbz	StarMoney macro file
.sda	OneSpace Designer assembly file
.opt	Psion Organiser OPL source
.lwa	Lightwright automated action file
.tpr	TIGCC IDE project file
.aep	Activ E-Book project file
.scro	Amira script object file
.mmbas	MindManager 7 macro
.phpproj	Microsoft Visual Studio PHP project
.rrh	BlackBerry resource header file
.vtml	Adobe ColdFusion Visual Tool Markup Language file
.xmta	Microsoft Visual Studio XMTA document
.atl	ATP Assembler source file
.epp	Python Egg file
.dmb	DHTML Menu Builder project file
.e	Euphoria include file
.wxs	Code::Blocks XML file
.adt	Caesar/Aldebaran Development Package compiler file
.xql	Microsoft Visual Studio xml file
.dc	Dialect compiled script
.vc1	Microsoft Visual C makefile
.vc15	Microsoft Visual C 1.5 make file
.msl	ProWORX Nxt MSL loadables file
.anm	Infinity equation script file
.ssc	HP Library and Tape Tools script
.rxs	ooRexx script file
.mli	F# source code
.xds	OpenGL Performer script file
.sml	SMIL Synchronized Multimedia Integration Language file
.hdl	Generated C header file
.mab	Markaby script file
.b	BuRg3r definition file
.rpres	RStudio presentation
.atm	Alphacam lathe parameter macro file
.rb	Fuzzy rule based definition file
.erb	Erubis script file
.gnumakefile	GNU Make makefile
.ccs	CodeCharge Studio project file
.alan	Alan v3 source code file
.c86	Computer Innovation C86 C language source code file
.ddb	INMOS Transputer Development System OCCAM debugging info
.oks	OKScript file
.pdb	PowerBASIC debugger file
.sqljet	Eclipse JET SQL template file
.capfile	Ruby Capistrano instruction file
.msh2xml	Windows PowerShell script file
.bsd	Boundary Scan Description Language file
.idle	IDle script file
.napj	Navicat Premium batch job
.lsxtproj	Microsoft Visual Studio LightSwitch project file
.for	Font resource file
.ll	Links programming language template file
.mpd	Monadic predicates
.tal	Typed Assembly Language file
.zasm	Zero Compiler assembly source file
.amf	Autolog macro files
.io	Io language script
.ebs	Eventcorder script file
.es	SageCRM script file
.codasite	Coda for Mac web project file
.rakefile	Ruby makefile
.m2	Modula 2 language source file
.prm	Prolog module file
.rip	Telegrafx Remote Imaging Protocol
.pbq	PunkBuster Query Script file
.m	Amiga E source module
.mbs	Mailbag Assistant script file
.fxcproj	nVidia FX Composer project file
.i	APLAC source code data file
.mfcribbon-ms	Microsoft Visual Studio Visual C++ ribbon resource code file
.qxm	Quexal macro file
.arscript	ArtRage script file
.chef	Acme::Chef Chef source code file
.gs	Geosoft montaj script file
.dplt	AppleScript Droplet file
.ds	DMDScript file
.cma	Camomile library file
.vjsproj	Microsoft Visual J# project
.scr	Wintask uncompiled program file
.slogo	StarLogo programming project file
.rtk	Racket source code file
.msh1	Microsoft Shell script file
.jlc	Byte compiled Lisp-based script file
.svx	Statistica macro file
.psl	Accellera property specification language source code file
.wpm	602Pro PC Suite macro file
.sar	Squeak package file
.qpr	Dinkum embedded C++ abridged library
.acm	Visual SourceSafe modules file
.msh2	Microsoft Shell script file
.ads	ADS applications file
.as?	LoseThos Assembly source file
.hid	OpenOffice.org Help ID file
.acr	ACRobot script file
.magik	Magik source code file
.cmp	SimCreator script file
.dbpro	DarkBASIC project file
.ocamlmakefile	Caml programming language makefile
.sfr	SF programming language repository file
.tlv	Transaction-Level Verilog files
.dif	Diff output from Diff command script for Patch command file
.t	Timber compiler source code
.win	ArchiCAD Geometric Description Language file
.csp	CaseWare Working Papers script page
.actproj	Microsoft Visual Studio Visual SourceSafe ACT project file
.gvy	Groovy script file
.anjuta	Anjuta DevStudio project file
.wbt	WinBatch script file
.ms	Modula-3 intermediate assembly file
.t	Tads source file
.vrm	Visual REXX language source code file
.wdx9	Microsoft Word for Mac wizard file
.z	Zero Compiler header file
.irev	Runtime Revolution script file
.wmlsc	Wireless Markup Language (WAP) bytecode script file
.scriptterminology	AppleScript script terminology file
.wsc	SGML Standard Generalized Markup Language file
.m	Limbo interface declaration file
.mbtemmplate	ModelBaker custom template directory
.idl	OMG CORBA interface definition language file
.au?	LoseThos autofile
.csview	Microsoft Visual Studio views file
.rbc	IBM Rembo-C script file
.ds	DragonSpeak source file
.eql	Embedded SQL file
.st	LittleSmalltalk language source code file
.sw	Free Pascal assembler file
.ept	Clarion for Windows embed points file
.bks	Microsoft Windows 2000 scheduled backup script
.des	V+ Visual Development System design file
.w32	Compiler makefile
.gas	Atari Jaguar GPU assembly source file
.smw	Stenn Media web script
.yml2	YML script file
.ephtml	Enhanced Perl-parsed HTML file
.owx	OutWit Hub script file
.rguninst	RealArcade uninstall script file
.fpp	Fortran source code file
.msdev	Microsoft Visual C+ make file
.gsym	ArchiCAD for Mac Geometric Description Language file
.tcl	SLIDE: Scene Language for Interactive Dynamic Environments file
.das	Atari Jaguar DSP assembly source file
.cbs	Cardbox macro script file
.tig	COREX syntactic annotation file
.adt	COBOL project file
.fbz6	FinalBuilder compressed project file
.emakefile	Erlang make file
.startlet	Start++ script
.rdoff	Netwide assembler file
.wsp	Microsoft Fortran Powerstation workspace file
.l1i	NutkungX script file
.msct	MOPEKS script file
.nsx	AppStudio project
.dpq	Clarion file
.exc	Rexx language source code file
.hsdl	Hierarchical Scan Description Language
.pcs	KDevelop persistent code store file
.ss	Sam Spade script file
.ccp	CodeCharge Studio page file
.umlclass	Java UML class model file
.sps	VAX/VMS source code
.pbxbtree	Apple Xcode auto-complete file
.xlm3	Microsoft Excel 3 for Mac Macro file
.db2tbl	Microsoft Visual Studio DB2 table script
.sml	Simple Markup Language file
.erubis	Erubis script file
.ccs	Visual CCScript script file
.zsrc	Zero source file
.cus	ConciseURI syntax file
.clx	Macro ToolsWorks macro file
.nrs	NovaBACKUP restore script file
.axe	Annotated XML example file
.mbam	Malwarebytes Anti-Malware script
.nms	Virtools graphical script file
.kdevprj	KDevelop project file
.yajl	YAJL script file
.celx	Celestia 3D rendering script file
.ptb	PubTech BatchWorks script file
.mmch	CodeWarrior compiled hdr file
.rssc	Claris Resolve script file
.msl	MAINSAIL source code file
.mli	Camomile individual module file
.agls	Adobe GoLive snippet file
.lgt	Logtalk programming language source code file
.actx	DS Game Maker action description file
.tatxtt	thinBasic template
.netproject	netfabb Basic project file
.l	Lisp language source
.pm	Pidgin instant messenger module file
.csgrad	Microsoft Visual Studio gradients file
.3dfbat	3DField command file
.sim	Telix simple script source file
.pbx5script	Personal Backup script file
.zcls	Zero Compiler class file
.zfrm	Zero form designer file
.lwmw	Likno Web Modal Windows Builder file
.zms	Zephyr ECLIPSE Server macro script file
.mc6	Microsoft C makefile
.dml	Digital Moderation meeting script file
.ufdl	Universal Forms Description Language file
.msym	ArchiCAD for MAC Geometric Description Language file
.isym	ArchiCAD for Mac Geometric Description Language file
.seestyle	Coda for Mac style sheet file
.ad	AxSys script file
.cp	CPIde source code file
.pnpt	Programmer's Notepad project template file
.nsconfig	nsconfig authentication file
.geany	Geany project
.install	Microsoft Expression Web PHP script
.rsym	ArchiCAD for Mac Geometric Description Language file
.sl	Sam Spade startup script
.lxsproj	Liquid XML Studio project file
.mpkt	MOPEKS trial file
.sscs	Saropa Smart Copy script file
.bbproject	BBEdit project file
.nopj	Navicat for Oracle batch job
.exprwdxsl	Microsoft Expression Web sheet
.wowproj	AddOn Studio for World of Warcraft project file
.pbxscript	Personal Backup script file
.cprr	Adobe Captivate XML script file
.dadx	Eclipse Document Access Definition Extension file
.tracwiki	Eclipse IDE WikiText file
.transcriptstyle	Apple iChat transcript style file
.plac	plac script file
.nmpj	Navicat for MariaDB batch job
.fil	ZENworks application source file
.jetinc	Eclipse IDE template fragment file
.db2tr	Microsoft Visual Studio DB2 trigger script file
.db2vw	Microsoft Visual Studio DB2 view script file
.fsscript	Microsoft Visual Studio F# script file
.artproj	Artifacts project file
.xqr	XML Query Language for DB2 file
.vbhtml	Microsoft Visual Studio ASP.NET web page
.ttinclude	Microsoft Visual Studio text template
.sjava	Synchronous Java source code file
.nppj	Navicat for PostgreSQL batch job
.rqb	RapidQ quellcode file
.xmsc	FileMaker script
.ccproj	Microsoft Visual Studio cloud service project
.kmdi	Kermeta file
.adiumscripts	Adium AppleScripts file
.gbap	GLBasic project file
.propertiesjet	Eclipse IDE template file
.snapx	Snapform XML form
.rbvcp	Real Studio project file
.nspj	Navicat for SQL Server batch job file
.ls3proj	Microsoft Visual Studio LightSwitch project
.mvpl	Microsoft Visual Programming Language project
.pawn	Pawn scripting language source code
.xscscpt	Transcribe! script
.tzs	TUGZip script file
.cord	Microsoft Visual Studio script
.jscript	Microsoft JScript file
.itmx	XML Model Interchange Language file
.vcwin32	Visual C make file
.php6	Microsoft Expression Web php script
.emakerfile	Erlang make file
.nlpj	Navicat for SQlite batch job
.tbasic	thinBasic script file
.module	Microsoft Expression Web PHP script
.sdsb	Spybot compiled script
.nunit	NUnit test project
.tbasicc	thinBasic script file
.xmss	FileMaker script
.xweb4asax	Microsoft Expression Web server app
.tbasicx	thinBasic script
.shfb	Sandcastle Help File Builder project
.ew	Euphoria code file